{
  "schema_version": "1.0",
  "generated_at": "2026-02-03T04:43:18Z",
  "area": "core",
  "patterns": [
    {
      "pattern_id": "core.entity_builder.create",
      "name": "EntityBuilder.create config table",
      "doc_id": "pattern:core.entity_builder.create",
      "category": "builder",
      "description": "Create entity via config table with sprite, position, size, and optional data.",
      "source_refs": ["assets/scripts/core/entity_builder.lua:14"],
      "recommended": true,
      "verified": true,
      "test_id": "test_core_patterns.lua::core.entity_builder.create",
      "cm_rule_id": null,
      "anti_patterns": []
    },
    {
      "pattern_id": "core.entity_builder.fluent_chain",
      "name": "EntityBuilder fluent chain",
      "doc_id": "pattern:core.entity_builder.fluent_chain",
      "category": "builder",
      "description": "Fluent builder chain for quick entity spawn at coordinates.",
      "source_refs": ["assets/scripts/core/procgen/spawner.lua:9"],
      "recommended": true,
      "verified": true,
      "test_id": "test_core_patterns.lua::core.entity_builder.fluent_chain",
      "cm_rule_id": null,
      "anti_patterns": []
    },
    {
      "pattern_id": "core.child_builder.attach_offset",
      "name": "ChildBuilder attach with offset",
      "doc_id": "pattern:core.child_builder.attach_offset",
      "category": "builder",
      "description": "Attach child to parent with offset and rotation inheritance.",
      "source_refs": ["assets/scripts/core/child_builder.lua:12"],
      "recommended": true,
      "verified": true,
      "test_id": "test_core_patterns.lua::core.child_builder.attach_offset",
      "cm_rule_id": null,
      "anti_patterns": []
    },
    {
      "pattern_id": "core.shader_builder.add_apply",
      "name": "ShaderBuilder add and apply",
      "doc_id": "pattern:core.shader_builder.add_apply",
      "category": "builder",
      "description": "Apply one or more shader passes to an entity via ShaderBuilder.",
      "source_refs": ["assets/scripts/core/shader_builder.lua:9"],
      "recommended": true,
      "verified": true,
      "test_id": "test_core_patterns.lua::core.shader_builder.add_apply",
      "cm_rule_id": null,
      "anti_patterns": []
    },
    {
      "pattern_id": "core.physics_builder.basic_chain",
      "name": "PhysicsBuilder fluent chain",
      "doc_id": "pattern:core.physics_builder.basic_chain",
      "category": "builder",
      "description": "Configure collision shape, tag, and physics settings before apply.",
      "source_refs": ["assets/scripts/core/physics_builder.lua:13"],
      "recommended": true,
      "verified": true,
      "test_id": "test_core_patterns.lua::core.physics_builder.basic_chain",
      "cm_rule_id": null,
      "anti_patterns": []
    },
    {
      "pattern_id": "core.timer.after_basic",
      "name": "Timer after basic",
      "doc_id": "pattern:core.timer.after_basic",
      "category": "timer",
      "description": "Schedule one-shot delayed work via timer.after.",
      "source_refs": ["assets/scripts/core/main.lua:704"],
      "recommended": true,
      "verified": true,
      "test_id": "test_core_patterns.lua::core.timer.after_basic",
      "cm_rule_id": null,
      "anti_patterns": []
    },
    {
      "pattern_id": "core.timer.every_guarded_tick",
      "name": "Timer every guarded tick",
      "doc_id": "pattern:core.timer.every_guarded_tick",
      "category": "timer",
      "description": "Repeat timer with entity validity guard and optional immediate tick.",
      "source_refs": ["assets/scripts/core/behaviors.lua:210"],
      "recommended": true,
      "verified": true,
      "test_id": "test_core_patterns.lua::core.timer.every_guarded_tick",
      "cm_rule_id": null,
      "anti_patterns": []
    },
    {
      "pattern_id": "core.timer.tween_scalar",
      "name": "Timer tween scalar",
      "doc_id": "pattern:core.timer.tween_scalar",
      "category": "timer",
      "description": "Tween a scalar value via getter and setter callbacks.",
      "source_refs": ["assets/scripts/core/main.lua:146"],
      "recommended": true,
      "verified": true,
      "test_id": "test_core_patterns.lua::core.timer.tween_scalar",
      "cm_rule_id": null,
      "anti_patterns": []
    },
    {
      "pattern_id": "core.signal.emit",
      "name": "Signal emit",
      "doc_id": "pattern:core.signal.emit",
      "category": "signal",
      "description": "Emit event payloads via hump.signal for decoupled listeners.",
      "source_refs": ["assets/scripts/core/grid_transfer.lua:123"],
      "recommended": true,
      "verified": true,
      "test_id": "test_core_patterns.lua::core.signal.emit",
      "cm_rule_id": null,
      "anti_patterns": []
    },
    {
      "pattern_id": "core.signal.register",
      "name": "Signal register",
      "doc_id": "pattern:core.signal.register",
      "category": "signal",
      "description": "Register signal listeners for UI and game state events.",
      "source_refs": ["assets/scripts/core/main.lua:204"],
      "recommended": true,
      "verified": true,
      "test_id": "test_core_patterns.lua::core.signal.register",
      "cm_rule_id": null,
      "anti_patterns": []
    },
    {
      "pattern_id": "core.signal_group.cleanup",
      "name": "SignalGroup cleanup",
      "doc_id": "pattern:core.signal_group.cleanup",
      "category": "signal",
      "description": "Group signal handlers and clean them up in one call.",
      "source_refs": ["assets/scripts/core/signal_group.lua:73"],
      "recommended": true,
      "verified": true,
      "test_id": "test_core_patterns.lua::core.signal_group.cleanup",
      "cm_rule_id": null,
      "anti_patterns": []
    },
    {
      "pattern_id": "core.event_bridge.attach",
      "name": "Event bridge attach",
      "doc_id": "pattern:core.event_bridge.attach",
      "category": "signal",
      "description": "Bridge combat bus events into hump.signal.",
      "source_refs": ["assets/scripts/core/event_bridge.lua:271"],
      "recommended": true,
      "verified": true,
      "test_id": "test_core_patterns.lua::core.event_bridge.attach",
      "cm_rule_id": null,
      "anti_patterns": []
    }
  ]
}
